lemma,root,sources,phonetic,pos,glosses,norm_freq
banda,b-n-d-j,['Spagnol2011'],bɐndɐ,VERB,"to ban, to ostracise, to exile",134.47977124349003
basta,b-s-t-j,['Spagnol2011'],bɐstɐ,VERB,to suffice,65.6110435237481
ċempel,ċ-m-p-l,"['Spagnol2011', 'Falzon2013']",ʧɛmpɛl,VERB,"to ring, to call somebody on the phone",38.56263607375973
fonda,f-n-d-j,['Spagnol2011'],fɔndɐ,VERB,"to deepen, to plunge, to dive to the bottom, to cast liquid metal",210.7424792258141
fixkel,f-x-k-l,"['Spagnol2011', 'Falzon2013']",fɪʃkɛl,VERB,"to confuse, to thwart, to disrupt",17.7447502449271
tfixkel,f-x-k-l,"['Spagnol2011', 'Falzon2013']",tfɪʃkɛl,VERB,"to stumble, to become confused",15.51010726811851
gawda,g-w-d-j,['Spagnol2011'],gɐʊdɐ,VERB,"to enjoy, to take pleasure in something, to have an orgasm",88.83608516242839
għargħar,għ-r-għ-r,['Spagnol2011'],ɐːrɐːr,VERB,"to flood, to gurgle, to make a bubbling noise",34.049218930295346
kompla,k-m-pl-j,"['Spagnol2011', 'Falzon2013']",kɔmplɐ,VERB,to continue something,774.3940598070459
tkompla,k-m-pl-j,['Spagnol2011'],tkɔmplɐ,VERB,to be continued,35.946860093725256
kanta,k-n-t-j,"['Spagnol2011', 'Falzon2013']",kɐntɐ,VERB,to sing,21.76068852102297
kopra,k-p-r-j,['Spagnol2011'],kɔprɐ,VERB,"to cover, to account for",74.64188973702662
lesta,l-s-t-j,"['Spagnol2011', 'Falzon2013']",lɛstɐ,VERB,"to finish, to complete",149.6288051401314
tlesta,l-s-t-j,['Spagnol2011'],tlɛstɐ,VERB,to be finished,108.84757379496206
parta,p-r-t-j,['Spagnol2011'],pɐrtɐ,VERB,"to leave, to depart",724.9109602092772
qanqal,q-n-q-l,"['Spagnol2011', 'Falzon2013']",ʔɐnʔɐl,VERB,"to excite, to agitate, to arouse, to provoke",29.41945592268832
tqanqal,q-n-q-l,['Spagnol2011'],tʔɐnʔɐl,VERB,"to be excited, to be agitated, to be provoked, to be aroused",20.200049170971727
tranġa,r-n-ġ-j,['Spagnol2011'],trɐnʤɐ,VERB,"to be arranged, to be set straight, to be rectified or resolved",15.494059562719526
salva,s-l-v-j,"['Spagnol2011', 'Falzon2013']",sɐlvɐ,VERB,"to save somebody, to rescue, to redeem",63.71340236031818
solva,s-l-v-j,"['Spagnol2011', 'Falzon2013']",sɔlvɐ,VERB,"to solve, to figure out",38.446290209617096
ssolva,s-l-v-j,['Spagnol2011'],ssɔlvɐ,VERB,to be solved,16.729732878441332
serva,s-r-v-j,"['Spagnol2011', 'Falzon2013']",sɛrvɐ,VERB,"to serve, to be appropriate for something",116.42610266963248
varja,v-r-j-j,"['Spagnol2011', 'Falzon2013']",vɐrjɐ,VERB,"to vary, to improvise (on an instrument)",39.710047009787125
tvarja,v-r-j-j,['Spagnol2011'],dvɐrjɐ,VERB,to be varied,27.33726614717008
xandar,x-n-d-r,"['Spagnol2011', 'Falzon2013']",ʃɐndɐr,VERB,"to advertise, to publicise, to broadcast, to circulate, to reveal",34.79944915769787
xxandar,x-n-d-r,['Spagnol2011'],ʃʃɐndɐr,VERB,"to be broadcast, to be advertised",31.730325500142083
bidel,b-d-l,"['Spagnol2011', 'Falzon2013']",bɪdɛl,VERB,"to change something, to alter something",70.67008265077796
biddel,b-d-l,"['Spagnol2011', 'Falzon2013']",bɪddɛl,VERB,"to change something, to alter something, to change one's clothes",110.35204617611686
tbiddel,b-d-l,['Spagnol2011'],dbɪddɛl,VERB,"to be changed, to be exchanged",61.20594839172685
nbidel,b-d-l,['Spagnol2011'],mbɪdɛl,VERB,"to change, to be changed, to be exchanged",191.6617575064215
bagħat,b-għ-t,['Spagnol2011'],bɐːt,VERB,"to send, to dismiss, to discharge from one's duties, to fire",237.82699401295017
bell,b-l-l,['Spagnol2011'],bɛll,VERB,"to dunk, to dip",30.02124487515024
baqa',b-q-għ,['Spagnol2011'],bɐʔɐ,VERB,"to remain, to stay, to carry on, to persist",1205.519677277114
beraħ,b-r-ħ,['Spagnol2011'],bɛrɐh,VERB,to open wide,33.82053912835981
beża',b-ż-għ,['Spagnol2011'],bɛzɐ,VERB,"to fear, to be afraid",49.11801429994178
beda,b-d-j,"['Spagnol2011', 'Falzon2013']",bɛdɐ,VERB,"to begin, to start",814.1723095647786
nbeda,b-d-j,['Spagnol2011'],mbɛdɐ,VERB,to be started,59.06759164731216
bieda,b-d-w,['Spagnol2011'],bɪːdɐ,VERB,"to perform agricultural activities, to work the land",274.85306229475714
bied,b-j-d,['Spagnol2011'],bɪːd,VERB,to lay eggs,417.8341054733592
biegħ,b-j-għ,['Spagnol2011'],bɪːh,VERB,"to sell, to betray",55.91421753641171
nbiegħ,b-j-għ,['Spagnol2011'],mbɪːh,VERB,"to be sold, to be bribed or corrupted",77.7110133945824
beka,b-k-j,"['Spagnol2011', 'Falzon2013']",bɛkɐ,VERB,"to cry, to shed tears, to mourn somebody",23.19695815423208
bena,b-n-j,"['Spagnol2011', 'Falzon2013']",bɛnɐ,VERB,"to build, to pile, to make or create something",181.15853432278615
nbena,b-n-j,['Spagnol2011'],mbɛnɐ,VERB,"to be built, to be built up (used of a location or environment which has become urbanised), to be created",128.31745237028
barra,b-r-j,['Spagnol2011'],bɐrrɐ,VERB,"to exclude, to debar, to refuse",1101.6910233456842
bata,b-t-j,['Spagnol2011'],bɐtɐ,VERB,"to suffer, to experience hardship, to encounter difficulties",68.29502225172824
bies,b-w-s,['Spagnol2011'],bɪːs,VERB,to kiss,31.313085159768487
baxxa,b-x-j,"['Spagnol2011', 'Falzon2013']",bɐʃʃɐ,VERB,"to lower, to diminish, to degrade, to humiliate",77.93969319651792
ċaħad,ċ-ħ-d,"['Spagnol2011', 'Falzon2013']",ʧɐhɐt,VERB,"to deny, to disavow, to disclaim, to adjure, to deprive somebody of something, to disown, to renounce, to repudiate",50.843142630332615
ċara,ċ-r-j,['Spagnol2011'],ʧɐrɐ,VERB,"to clarify, to enlighten",327.89474056475063
deher,d-h-r,['Spagnol2011'],dɛːr,VERB,"to appear, to be seen, to resemble something or somebody, to make a spectacle of oneself, to give the impression of something",702.4923157668958
daħak,d-ħ-k,"['Spagnol2011', 'Falzon2013']",dɐhɐk,VERB,"giggle, laugh",36.10332522136536
daħal,d-ħ-l,['Spagnol2011'],dɐhɐl,VERB,"to enter, to gain entry, to obtain a job or responsibility, to start (usually used of seasons or other identifiable periods in the calendar), to become fashionable, to be imported",1074.6867470855432
daħħal,d-ħ-l,"['Spagnol2011', 'Falzon2013']",dɐhhɐl,VERB,"to insert, to give somebody a specific occupation, to import, to earn (used for money or profit), to introduce (especially a fashion or habit)",301.5724917840663
ddaħħal,d-ħ-l,['Spagnol2011'],ddɐhhɐl,VERB,"to be inserted, to be forced in, to be allowed in",138.61606731007828
ndaħal,d-ħ-l,['Spagnol2011'],ndɐhɐl,VERB,to interfere,24.66532319823916
dell,d-l-l,['Spagnol2011'],dɛll,VERB,"to shade, to cast a shadow",39.06011494112825
dlam,d-l-m,['Spagnol2011'],dlɐm,VERB,to grow dark,47.0318125980738
dann,d-n-n,['Spagnol2011'],dɐnn,VERB,to make a supposition,181.4393691672684
daqq,d-q-q,['Spagnol2011'],dɐʔʔ,VERB,"to play (an instrument or a piece of music), to beat cotton",42.0570239243886
dgħajjef,d-j-f,['Spagnol2011'],dɐɪjɛf,VERB,"to weaken, to enfeeble",25.70441212282341
dejjaq,d-j-q,"['Spagnol2011', 'Falzon2013']",dɛɪjɐʔ,VERB,"to narrow something, to annoy somebody, to bore somebody, to give somebody trouble",29.487658670634
ddejjaq,d-j-q,['Spagnol2011'],ddɛɪjɐʔ,VERB,"to be annoyed, to be bored, to be depressed, to be troubled",38.35802782992268
dar,d-j-r,['Spagnol2011'],dɐr,VERB,"to reside, to dwell",695.2347410002051
dara,d-r-j,['Spagnol2011'],dɐrɐ,VERB,"to get used to something, to acquire a habit, to become familiar with somebody or something",33.423358419734946
dwal,d-w-l,['Spagnol2011'],dwɐl,VERB,to become illuminated,30.173698076440587
diem,d-w-m,['Spagnol2011'],dɪːm,VERB,"to take a long time, to delay",138.53984070943312
dar,d-w-r,"['Spagnol2011', 'Falzon2013']",dɐr,VERB,"to turn, to veer, to take a turning, to travel extensively, to walk about, to change one's views, to scrutinise something, to take a tour of a place",708.542300702313
dawwar,d-w-r,"['Spagnol2011', 'Falzon2013']",dɐʊwɐr,VERB,"to turn, to spin, to encircle, to take somebody around a place, to change somebody's views on something, to enclose",41.43116341382821
fadal,f-d-l,['Spagnol2011'],fɐdɐl,VERB,"to remain, to be left over",90.8460602636512
ftehem,f-h-m,['Spagnol2011'],ftɛːm,VERB,"to be understood, to make an agreement with somebody",23.91509297083664
faħħar,f-ħ-r,"['Spagnol2011', 'Falzon2013']",fɐhhɐr,VERB,"to praise, to flatter",53.61939566435693
ftaħar,f-ħ-r,['Spagnol2011'],ftɐhɐr,VERB,to boast,63.62915190697351
fakkar,f-k-r,['Spagnol2011'],fɐkkɐr,VERB,"to remind, to commemorate",173.23497978203758
tfakkar,f-k-r,['Spagnol2011'],tfɐkkɐr,VERB,"to be remembered, to be commemorated",44.36789350184237
ftakar,f-k-r,['Spagnol2011'],ftɐkɐr,VERB,to remember something,151.8112930743933
felaħ,f-l-ħ,['Spagnol2011'],fɛlɐh,VERB,"to endure, to afford something financially, to manage something or somebody successfully, to be strong",70.89073860001399
files,f-l-s,['Spagnol2011'],fɪlɛs,VERB,"to earn a lot of money, to donate money",19.29736574227885
faqar,f-q-r,['Spagnol2011'],fɐʔɐr,VERB,"to impoverish, to ruin somebody financially",129.62132843394747
fqar,f-q-r,['Spagnol2011'],fʔɐr,VERB,to become impoverished,26.23398640098989
feraħ,f-r-ħ,"['Spagnol2011', 'Falzon2013']",fɛrɐh,VERB,"to be happy, to be glad, to congratulate somebody, to wish somebody well",31.67014660489589
nfirex,f-r-x,['Spagnol2011'],nfɪrɛʃ,VERB,"to be dispersed, to be spread",22.33038206268692
fassal,f-s-l,['Spagnol2011'],fɐssɐl,VERB,"to design, to draw up a blueprint for something, to plan something",51.272418749755445
tfassal,f-s-l,['Spagnol2011'],tfɐssɐl,VERB,"to be planned, to be designed",42.422109222215504
fisser,f-s-r,"['Spagnol2011', 'Falzon2013']",fɪssɛr,VERB,to explain,446.8644045401221
tfisser,f-s-r,['Spagnol2011'],tfɪssɛr,VERB,to be explained,366.36510233246617
fetaħ,f-t-ħ,"['Spagnol2011', 'Falzon2013']",fɛtɐh,VERB,"to open, to start (e.g. an even, to unfurl or unfold, to cause frequent bowel movement or diarrhoea (used especially of food)",255.37114794039
nfetaħ,f-t-ħ,['Spagnol2011'],nfɛtɐh,VERB,"to open, to be opened to the public, to expand physically, to have diarrhoea",89.62643465332837
fittex,f-t-x,['Spagnol2011'],fɪttɛʃ,VERB,"to search, to seek, to wish for the company of somebody, to be punctilious, to sue, to act quickly, to ensure that something is the case",90.91025108524714
tfittex,f-t-x,['Spagnol2011'],tfɪttɛʃ,VERB,"to be searched for, to be researched",58.413647652303545
fela,f-l-j,"['Spagnol2011', 'Falzon2013']",fɛlɐ,VERB,"to inspect, to scrutinise",16.248301716471797
falla,f-l-j,['Spagnol2011'],fɐllɐ,VERB,"to fail, to go bankrupt",38.48239754676481
gideb,g-d-b,['Spagnol2011'],gɪdɛp,VERB,"to lie, to prevaricate",33.80047949661108
garr,g-r-r,['Spagnol2011'],gɐrr,VERB,"to grumble, to complain, to coo (used especially of pigeons)",81.19336546616204
ngarr,g-r-r,['Spagnol2011'],ngɐrr,VERB,to be the object of complaint,15.076819222345929
gaża,g-ż-j,['Spagnol2011'],gɐzɐ,VERB,"to tell on somebody, to grass on somebody, to accuse somebody",18.90820888635348
ġibed,ġ-b-d,"['Spagnol2011', 'Falzon2013']",ʤɪbɛt,VERB,"to pull, to attract, to withdraw money (e.g. from a bank), to curse or blaspheme",87.0186825259934
ġabar,ġ-b-r,"['Spagnol2011', 'Falzon2013']",ʤɐbɐr,VERB,"to collect, to compile, to assemble, to marry or find a mate",28.03935325837565
nġabar,ġ-b-r,['Spagnol2011'],nʤɐbɐr,VERB,"to be collected, to be repaired, to settle down",204.54806494180608
ġġedded,ġ-d-d,['Spagnol2011'],ʤʤɛddɛt,VERB,"to be renewed, to be restored, to be refreshed",20.09172715952858
ġiegħel,ġ-għ-l,"['Spagnol2011', 'Falzon2013']",ʤɪːjɛːl,VERB,"to force, to compel",18.783839169511342
ġġieled,ġ-l-d,"['Spagnol2011', 'Falzon2013']",ʤʤɪːlɛt,VERB,to fight,17.45589154774538
ġarr,ġ-r-r,"['Spagnol2011', 'Falzon2013']",ʤɐrr,VERB,"to carry something, to shift the position of something, to carry a child during pregnancy, to move house",16.087824662481953
ġie,,"['Spagnol2011', 'Falzon2013']",ʤɪː,VERB,"to come, to have an orgasm",7057.92125189562
ġab,ġ-j-b,['Spagnol2011'],ʤɐp,VERB,"to bring, to acquire as payment, to estimate or calculate, to cause something to look a certain way, to hold somebody in high esteem, to have an orgasm, to ejaculate",207.09563817389488
ġara,ġ-r-j,"['Spagnol2011', 'Falzon2013']",ʤɐrɐ,VERB,"to happen, to be the case, to occur",349.8881208140589
ġera,ġ-r-j,['Spagnol2011'],ʤɛrɐ,VERB,"to run, to roam, to flow (used especially of water), to be promiscuous, to have a lot of life experience, to travel widely",52.79695076265897
hedded,h-d-d,"['Spagnol2011', 'Falzon2013']",ɛːddɛt,VERB,to threaten,41.97678539739368
ħabb,ħ-b-b,['Spagnol2011'],hɐbp,VERB,"to love, to like, to enjoy",76.8845565665347
ħebb,ħ-b-b,['Spagnol2011'],hɛbp,VERB,"to attack somebody, to assault somebody",22.530978380174226
ħabbar,ħ-b-r,['Spagnol2011'],hɐbbɐr,VERB,"to announce, to forecast",254.9218121892184
tħabbar,ħ-b-r,['Spagnol2011'],thɐbbɐr,VERB,"to be announced, to be forecast",107.45944727794988
ħabat,ħ-b-t,['Spagnol2011'],hɐbɐt,VERB,"to bump, to crash in one's car, to occur, to be timely (said of an event or occurrence), to be about to attack somebody",38.32994434547446
ħabbat,ħ-b-t,"['Spagnol2011', 'Falzon2013']",hɐbbɐt,VERB,"to knock, to beat eggs, to cause trouble, to cause inconvenience for somebody",27.814685382789868
tħabbat,ħ-b-t,['Spagnol2011'],thɐbbɐt,VERB,"to be knocked, to be inconvenienced",16.372671433313926
ħadem,ħ-d-m,['Spagnol2011'],hɐdɛm,VERB,"to work, to be employed, to act (in a pla, to function properly (used of a devic, to trick or deceive, to work out (e.g. a sum or calculation)",986.4845462863748
ħaddem,ħ-d-m,['Spagnol2011'],hɐddɛm,VERB,"to employ, to force to work, to use frequently, to force into prostitution",58.23712289291472
tħaddem,ħ-d-m,['Spagnol2011'],thɐddɛm,VERB,"to be employed, to be used frequently",93.87907658405928
nħadem,ħ-d-m,['Spagnol2011'],nhɐdɛm,VERB,"to be made, to be manufactured, to be worked out (e.g. used of a sum or calculation), to be tricked or deceived",43.16832752326828
ħaddan,ħ-d-n,['Spagnol2011'],hɐddɐn,VERB,"to embrace, to hug, to lean towards an ideology or point of view",27.08852671348582
tħaddan,ħ-d-n,"['Spagnol2011', 'Falzon2013']",thɐddɐn,VERB,to be embraced,17.191104408662135
ħfief,ħ-f-f,['Spagnol2011'],hfɪːf,VERB,"to become lighter, to become easier, to become foolish or light-headed",34.277898732230874
ħeġġeġ,ħ-ġ-ġ,"['Spagnol2011', 'Falzon2013']",hɛʤʤɛʧ,VERB,"to inspire with enthusiasm, to encourage, to blaze",59.67740445247357
tħeġġeġ,ħ-ġ-ġ,['Spagnol2011'],thɛʤʤɛʧ,VERB,"to be encouraged, to acquire an enthusiasm for something",23.83084251749197
ħakem,ħ-k-m,"['Spagnol2011', 'Falzon2013']",hɐkɛm,VERB,"to rule, to colonise, to subdue, to subject",19.622331776608284
ħall,ħ-l-l,"['Spagnol2011', 'Falzon2013']",hɐll,VERB,"to untie, to loosen, to unravel, to break up a relationship or contrct, to absolve of a responsibility",405.59371818028376
nħall,ħ-l-l,['Spagnol2011'],nhɐll,VERB,"to be untied, to be loosened, to be unravelled, to be broken up (used of a relationship or contract), to be absolved of a responsibility",140.3131121560209
ħallel,ħ-l-l,['Spagnol2011'],hɐllɛl,VERB,to turn into vinegar,65.9079260736293
ħolom,ħ-l-m,['Spagnol2011'],hɔlɔm,VERB,"to dream, to fancy, to imagine, to wish for something",18.964375855249923
ħalaq,ħ-l-q,"['Spagnol2011', 'Falzon2013']",hɐlɐʔ,VERB,to create,219.67703920669868
ħallas,ħ-l-s,"['Spagnol2011', 'Falzon2013']",hɐllɐs,VERB,"to pay, to make amends or atone for something",430.0062900184889
tħallas,ħ-l-s,['Spagnol2011'],thɐllɐs,VERB,"to be paid, to be settled, to be punished",514.028063561222
ħeles,ħ-l-s,"['Spagnol2011', 'Falzon2013']",hɛlɛs,VERB,"to become free of something, to escape, to set somebody free, to finish, to pardon, to give birth",27.734446855794943
ħallat,ħ-l-t,"['Spagnol2011', 'Falzon2013']",hɐllɐt,VERB,"mix, blend, mingle, confuse, mistake, compare, mate a goat, dilute",16.765840215589048
ħmar,ħ-m-r,['Spagnol2011'],hmɐr,VERB,"to become red, to blush, to become inflamed",16.42081454951088
ħaqq,ħ-q-q,['Spagnol2011'],hɐʔʔ,VERB,to deserve,30.6270457539619
ħaqqaq,ħ-q-q,"['Spagnol2011', 'Falzon2013']",hɐʔʔɐʔ,VERB,"to curse, to argue firmly, to argue with somebody",21.820867416269163
ħarab,ħ-r-b,['Spagnol2011'],hɐrɐp,VERB,"to run away, to escape, to evade or avoid somebody",69.87572123352822
ħareġ,ħ-r-ġ,"['Spagnol2011', 'Falzon2013']",hɐrɛʧ,VERB,"to exit, to leave, to go out, to take something out, to be published, to be made public, to stand for election",400.5707863904016
tħarreġ,ħ-r-ġ,['Spagnol2011'],thɐrrɛʧ,VERB,to be trained,15.265379760783995
nħareġ,ħ-r-ġ,['Spagnol2011'],nhɐrɛʧ,VERB,"to be brought out, to be published",109.2166710191387
ħaraq,ħ-r-q,['Spagnol2011'],hɐrɐʔ,VERB,"to burn, to put to the flame, to burn a disc (C, to irritate or enrage somebody",25.76057909171985
ħares,ħ-r-s,"['Spagnol2011', 'Falzon2013']",hɐrɛs,VERB,"to look, to watch, to protect, to keep under surveillance, to pass the time doing nothing, to stare",269.2403773314623
tħares,ħ-r-s,['Spagnol2011'],thɐrɛs,VERB,"to be kept under surveillance, to be protected, to be observed (use",178.11348222332887
ħaseb,ħ-s-b,['Spagnol2011'],hɐsɛp,VERB,"to think, to mistake something for something else, to plan for something in advance",838.5407502131366
ħassar,ħ-s-r,"['Spagnol2011', 'Falzon2013']",hɐssɐr,VERB,"to cause something to rot, to spoil, to damage, to vandalise, to cancel an event, to discourage somebody from doing something",41.26266250713887
tħassar,ħ-s-r,['Spagnol2011'],thɐssɐr,VERB,"to rot, to be ruined, to be annulled, to be cancelled",49.46303996601995
tħassar,ħ-s-r,['Spagnol2011'],thɐssɐr,VERB,to have pity on somebody,49.46303996601995
ħass,ħ-s-s,['Spagnol2011'],hɐss,VERB,"to sense, to feel, to touch",309.56424907276056
ħasses,ħ-s-s,['Spagnol2011'],hɐssɛs,VERB,"to feel, to touch, to figure out",24.039462687678768
nħass,ħ-s-s,['Spagnol2011'],nhɐss,VERB,"to be felt, to be experienced, to have an effect on others",57.70754861474823
ħataf,ħ-t-f,"['Spagnol2011', 'Falzon2013']",hɐtɐf,VERB,"to seize, to snatch away, to kidnap, to snap at somebody, to scold somebody",20.74165922818745
ħatar,ħ-t-r,"['Spagnol2011', 'Falzon2013']",hɐtɐr,VERB,"to elect, to select somebody for a position of responsibility",36.57272060428566
nħatar,ħ-t-r,['Spagnol2011'],nhɐtɐr,VERB,"to be appointed, to be selected for a position",66.08043890666839
ħażen,ħ-ż-n,['Spagnol2011'],hɐzɛn,VERB,"to store something, to stock up on something, to preserve (e.g. in brine or oil)",18.145942879901718
ħażen,ħ-ż-n,['Spagnol2011'],hɐzɛn,VERB,to mourn,18.145942879901718
ħeba,ħ-b-j,['Spagnol2011'],hɛbɐ,VERB,"to hide, to keep secret",27.481695495760945
ħaba,ħ-b-j,['Spagnol2011'],hɐbɐ,VERB,to shuffle on one's bottom,20.7978261970839
nħtieġ,ħ-j-ġ,['Spagnol2011'],nhtɪːʧ,VERB,"to be needed, to be required, to be necessary",31.39733561311316
ħejja,ħ-j-j,"['Spagnol2011', 'Falzon2013']",hɛɪjɐ,VERB,to prepare,38.446290209617096
tħejja,ħ-j-j,['Spagnol2011'],thɛɪjɐ,VERB,to prepare oneself,16.27638520092002
ħiel,ħ-j-l,['Spagnol2011'],hɪːl,VERB,"to imagine, to conceive in one's imagination",17.255295230258074
ħan,ħ-j-n,['Spagnol2011'],hɐn,VERB,"to deceive, to renege on an agreement",572.3133295703336
ħar,ħ-j-r,['Spagnol2011'],hɐr,VERB,to make an effort,15.60238157416267
ħajjar,ħ-j-r,"['Spagnol2011', 'Falzon2013']",hɐɪjɐr,VERB,"to tempt, to induce, to entice, to incentivise",23.33336365012345
tħajjar,ħ-j-r,['Spagnol2011'],thɐɪjɐr,VERB,"to desire something, to have an appetite for something, to be attracted to something",24.12371314102344
ħajjet,ħ-j-t,['Spagnol2011'],hɐɪjɛt,VERB,to enclose with a wall or fence,132.52195118481393
ħela,ħ-l-j,"['Spagnol2011', 'Falzon2013']",hɛlɐ,VERB,"to waste, to fritter away, to use up",72.5356284034099
ħalla,ħ-l-j,"['Spagnol2011', 'Falzon2013']",hɐllɐ,VERB,"to leave somebody or something, to abandon",584.5777884215075
tħalla,ħ-l-j,['Spagnol2011'],thɐllɐ,VERB,"to be left, to be abandoned",145.96992830916292
ħela,ħ-l-w,['Spagnol2011'],hɛlɐ,VERB,"to become sweet, to become gentle",50.157103224526026
ħalla,ħ-l-w,['Spagnol2011'],hɐllɐ,VERB,"to sweeten, to soften",651.6331254311642
tħalla,ħ-l-w,['Spagnol2011'],thɐllɐ,VERB,to become sweet,72.70412931009923
ħata,ħ-t-j,['Spagnol2011'],hɐtɐ,VERB,"to be guilty, to be the cause of evil or harm done",44.90147970635861
ħawwad,ħ-w-d,"['Spagnol2011', 'Falzon2013']",hɐʊwɐt,VERB,"to stir, to mix, to muddle, to cause confusion, to be up to no good, to be promiscuous",29.37933665919085
kiber,k-b-r,['Spagnol2011'],kɪbɛr,VERB,"to grow up, to augment, to expand, to increase in stature, to become proud",191.8503180448596
kabbar,k-b-r,"['Spagnol2011', 'Falzon2013']",kɐbbɐr,VERB,"to grow something (especially vegetable, to enlarge, to augment, to increase, to become proud, to expand one's business, to heighten",53.50304980021429
tkabbar,k-b-r,['Spagnol2011'],tkɐbbɐr,VERB,"to become vain, to become proud, to be enlarged",41.83636797515257
kelel,k-l-l,['Spagnol2011'],kɛlɛl,VERB,"to put a crown on somebody, to put a wreath on somebody",4019.067578648671
kellel,k-l-l,['Spagnol2011'],kɛllɛl,VERB,to crown,459.1970661392417
kellem,k-l-m,['Spagnol2011'],kɛllɛm,VERB,"to speak to somebody, to converse, to be seeing somebody in a relationship",312.9021717957493
tkellem,k-l-m,"['Spagnol2011', 'Falzon2013']",tkɛllɛm,VERB,"to speak, to give a speech before an audience, to speak up",1112.992619872919
kenn,k-n-n,['Spagnol2011'],kɛnn,VERB,"to provide shelter, to provide succour",43.7179614331835
kiseb,k-s-b,"['Spagnol2011', 'Falzon2013']",kɪsɛp,VERB,"to get, to obtain, to achieve",176.0032089633624
nkiseb,k-s-b,['Spagnol2011'],nkɪsɛp,VERB,"to be acquired, to be achieved",58.06862198622538
kiser,k-s-r,['Spagnol2011'],kɪsɛr,VERB,"to break, to fracture, to snub somebody, to take a turn while driving",85.55031748198633
kisser,k-s-r,"['Spagnol2011', 'Falzon2013']",kɪssɛr,VERB,"to break, to smash, to force somebody to undergo intensive training",47.03582452442354
tkisser,k-s-r,['Spagnol2011'],tkɪssɛr,VERB,"to be broken, to undergo intensive training",34.614900545609544
nkiser,k-s-r,['Spagnol2011'],nkɪsɛr,VERB,"to break, to be snubbed, to be embarrassed",16.023633840886014
kiteb,k-t-b,['Spagnol2011'],kɪtɛp,VERB,"to write, to enrol somebody, to name somebody as the heir of something",211.9500690570877
nkiteb,k-t-b,['Spagnol2011'],nkɪtɛp,VERB,"to be written, to enrol oneself, to be enrolled",30.94398793559185
kixef,k-x-f,"['Spagnol2011', 'Falzon2013']",kɪʃɛf,VERB,"to uncover, to disclose",32.94995111046491
tkeċċa,k-ċ-j,['Spagnol2011'],tkɛʧʧɐ,VERB,"to be sent off, to be expelled, to be dispelled, to be driven away, to be fired, to be made redundant",33.30701255559231
kief,k-j-f,['Spagnol2011'],kɪːf,VERB,to outdo somebody,3159.877443513391
kejjel,k-j-l,['Spagnol2011'],kɛɪjɛl,VERB,"to measure, to weigh, to estimate",17.058710839120515
tkejjel,k-j-l,['Spagnol2011'],tkɛɪjɛl,VERB,"to be measured, to be estimated",20.14789412842503
kiel,k-j-l,['Spagnol2011'],kɪːl,VERB,"to eat, to weather, to erode, to tickle, to itch, to be given a punishment, to find oneself the victim of an action",516.6558753203057
kera,k-r-j,['Spagnol2011'],kɛrɐ,VERB,"to rent, to lease",144.94287516362792
nkera,k-r-j,['Spagnol2011'],nkɛrɐ,VERB,"to be rented, to be leased",15.8832164186449
kewa,k-w-j,['Spagnol2011'],kɛʊɐ,VERB,"to heat up to a high temperature, to burn white hot, to brand, to cauterise",18.093787837355013
kien,k-w-n,"['Spagnol2011', 'Falzon2013']",kɪːn,VERB,"to be, to exist",20565.96894947937
libes,l-b-s,['Spagnol2011'],lɪbɛs,VERB,"to wear, to put on, to get dressed, to join a religious orde",25.8167460606163
lagħab,l-għ-b,['Spagnol2011'],lɐːp,VERB,"to play, to pretend, to act, to gamble, to waver or be unsteady, to give a blow, to cheat somebody",140.98711578277823
ntlagħab,l-għ-b,['Spagnol2011'],ntlɐːp,VERB,"to be played, to be gambled (used of the money or winnings being gambled), to be cheated",21.15087571586156
laħaq,l-ħ-q,"['Spagnol2011', 'Falzon2013']",lɐhɐʔ,VERB,"to reach, to catch up, to be just in time, to be promoted",229.8071532398077
laħħaq,l-ħ-q,['Spagnol2011'],lɐhhɐʔ,VERB,"to enable timely arrival, to make it just in time, to cope",55.94631294720968
tlaħħaq,l-ħ-q,['Spagnol2011'],tlɐhhɐʔ,VERB,"to be reached, to be extended or lengthened to reach a spot, to be given a promotion",44.61663293552663
ntlaħaq,l-ħ-q,['Spagnol2011'],ntlɐhɐʔ,VERB,to be reached,88.38273748490708
laqqa',l-q-għ,['Spagnol2011'],lɐʔʔɐ,VERB,"to cause to meet, to call a meeting",16.320516390767228
ntlaqa',l-q-għ,['Spagnol2011'],ntlɐʔɐ,VERB,"to be accepted, to be assented to",22.202000419495043
ltaqa',l-q-għ,"['Spagnol2011', 'Falzon2013']",ltɐʔɐ,VERB,to meet,238.29237746952072
laqat,l-q-t,['Spagnol2011'],lɐʔɐt,VERB,"to hit, to brush against, to make an impression",131.46280262848094
ntlaqat,l-q-t,['Spagnol2011'],ntlɐʔɐt,VERB,"to be hit, to be brushed against",42.93162386863326
lema,l-m-j,['Spagnol2011'],lɛmɐ,VERB,"to glint, to glitter",394.9019344582104
liem,l-w-m,"['Spagnol2011', 'Falzon2013']",lɪːm,VERB,"to scold, to blame, to reproach",678.3886622576211
miegħek,m-għ-k,['Spagnol2011'],mɪːjɛːk,VERB,"to throw somebody down, to make somebody roll on the floor",48.73286937036615
marrar,m-r-r,['Spagnol2011'],mɐrrɐr,VERB,to make bitter,199.24831023379144
miel,m-j-l,"['Spagnol2011', 'Falzon2013']",mɪːl,VERB,"to incline, to bend, to kneel",356.0063084974217
mela,m-l-j,"['Spagnol2011', 'Falzon2013']",mɛlɐ,VERB,"to fill, to stuff, to become cloudy (used of the weather)",354.13675081844
mtela,m-l-j,['Spagnol2011'],mtɛlɐ,VERB,"to be filled up, to gain weight",28.13563949076956
